{
  "system_name": "TEST_SYSTEM",
  "version": "1.0.0",
  "decisions": [
    {
      "id": "DEC-001",
      "description": "Use PostgreSQL for primary database",
      "priority": 90,
      "confidence": 0.95,
      "tags": ["database", "infrastructure"]
    },
    {
      "id": "DEC-002",
      "description": "Deploy with Docker containers",
      "priority": 85,
      "confidence": 0.9,
      "tags": ["deployment", "containerization"]
    },
    {
      "id": "DEC-003",
      "description": "Use Redis for caching layer",
      "priority": 70,
      "confidence": 0.8,
      "tags": ["caching", "performance"]
    }
  ],
  "constraints": {
    "performance": {
      "type": "latency",
      "applies_to": ["DEC-001", "DEC-003"],
      "value": "< 100ms"
    },
    "availability": {
      "type": "uptime",
      "applies_to": ["DEC-001", "DEC-002"],
      "value": "99.9%"
    }
  },
  "metadata": {
    "version": "1.0.0",
    "created": "2026-02-14T00:00:00Z",
    "author": "Test Engineer",
    "description": "Test system for validation"
  }
}
